{
  "$schema": "./UNI_CLAIM_COVERAGE_G9_B_SCHEMA.json",
  "schema_version": "G9-B-claim-coverage",
  "audit_id": "G9-B-claim-coverage",
  "metadata_only": true,
  "observed_at": "2026-10-18",
  "scope": {
    "input_reports": [
      "docs/coordination/UNI_PROVENANCE_AUDIT_G6.json",
      "docs/coordination/UNI_REMEDIATION_QUEUE_G7_B.json"
    ],
    "record_scope": "All normalized G6 records; source_record_present distinguishes source from context/blocker.",
    "excluded_payloads": [
      "PDF bytes/content",
      "XML bytes/content",
      "course cards and values",
      "exam questions, answers, and solutions"
    ],
    "state_policy": "evidence_status is copied from G6 proof_state. claim_ready requires explicit claim_ready=true evidence; no field is promoted from URL, license, hash, local presence, or queue status."
  },
  "summary": {
    "record_count": 33,
    "source_record_present_count": 30,
    "url_present_count": 31,
    "license_present_count": 29,
    "claim_ready_count": 0,
    "by_evidence_status": {
      "verified": 0,
      "observed_local": 29,
      "context_only": 2,
      "blocked": 2
    },
    "remediation_item_count": 48,
    "remediation_open_item_count": 48,
    "remediation_claim_ready_count": 0,
    "residual_count": 17
  },
  "records": [
    {
      "record_key": "Fondamenti_Pack/PROVENANCE_MANIFEST_G2.json#G1-001",
      "manifest_path": "Fondamenti_Pack/PROVENANCE_MANIFEST_G2.json",
      "manifest_id": "G2-FONDAMENTI-PACK-G1-PROVENANCE",
      "record_id": "G1-001",
      "record_kind": "source",
      "title": "The Nicomachean Ethics",
      "local_path": "Fondamenti_Pack/raw/gutenberg/Aristotle_Ethics_pg8438.txt",
      "source_record_present": true,
      "url_present": true,
      "license_present": true,
      "evidence_status": "observed_local",
      "claim_ready": false,
      "evidence_basis": {
        "source_record": "G6 record_kind and record_id; no source payload read",
        "url": "G6 url.status and url.value",
        "license": "G6 license.status and license.label",
        "evidence_status": "G6 proof_state copied without promotion",
        "claim_ready": "not promoted; G6 has no explicit claim_ready=true evidence for this record"
      },
      "residual_codes": [
        "g6:external_url_availability_not_checked",
        "g6:independent_license_clearance_not_checked",
        "evidence_not_verified",
        "explicit_claim_ready_evidence_missing",
        "claim_not_ready"
      ]
    },
    {
      "record_key": "Fondamenti_Pack/PROVENANCE_MANIFEST_G2.json#G1-002",
      "manifest_path": "Fondamenti_Pack/PROVENANCE_MANIFEST_G2.json",
      "manifest_id": "G2-FONDAMENTI-PACK-G1-PROVENANCE",
      "record_id": "G1-002",
      "record_kind": "source",
      "title": "Calculus Made Easy",
      "local_path": "Fondamenti_Pack/raw/gutenberg/Calculus_Made_Easy_Thompson.txt",
      "source_record_present": true,
      "url_present": true,
      "license_present": true,
      "evidence_status": "observed_local",
      "claim_ready": false,
      "evidence_basis": {
        "source_record": "G6 record_kind and record_id; no source payload read",
        "url": "G6 url.status and url.value",
        "license": "G6 license.status and license.label",
        "evidence_status": "G6 proof_state copied without promotion",
        "claim_ready": "not promoted; G6 has no explicit claim_ready=true evidence for this record"
      },
      "residual_codes": [
        "g6:external_url_availability_not_checked",
        "g6:independent_license_clearance_not_checked",
        "evidence_not_verified",
        "explicit_claim_ready_evidence_missing",
        "claim_not_ready"
      ]
    },
    {
      "record_key": "Fondamenti_Pack/PROVENANCE_MANIFEST_G2.json#G1-003",
      "manifest_path": "Fondamenti_Pack/PROVENANCE_MANIFEST_G2.json",
      "manifest_id": "G2-FONDAMENTI-PACK-G1-PROVENANCE",
      "record_id": "G1-003",
      "record_kind": "source",
      "title": "Discourse on the Method",
      "local_path": "Fondamenti_Pack/raw/gutenberg/Descartes_Discourse_pg59.txt",
      "source_record_present": true,
      "url_present": true,
      "license_present": true,
      "evidence_status": "observed_local",
      "claim_ready": false,
      "evidence_basis": {
        "source_record": "G6 record_kind and record_id; no source payload read",
        "url": "G6 url.status and url.value",
        "license": "G6 license.status and license.label",
        "evidence_status": "G6 proof_state copied without promotion",
        "claim_ready": "not promoted; G6 has no explicit claim_ready=true evidence for this record"
      },
      "residual_codes": [
        "g6:external_url_availability_not_checked",
        "g6:independent_license_clearance_not_checked",
        "evidence_not_verified",
        "explicit_claim_ready_evidence_missing",
        "claim_not_ready"
      ]
    },
    {
      "record_key": "Fondamenti_Pack/PROVENANCE_MANIFEST_G2.json#G1-004",
      "manifest_path": "Fondamenti_Pack/PROVENANCE_MANIFEST_G2.json",
      "manifest_id": "G2-FONDAMENTI-PACK-G1-PROVENANCE",
      "record_id": "G1-004",
      "record_kind": "source",
      "title": "Relativity: The Special and General Theory",
      "local_path": "Fondamenti_Pack/raw/gutenberg/Einstein_Relativity_pg30155.txt",
      "source_record_present": true,
      "url_present": true,
      "license_present": true,
      "evidence_status": "observed_local",
      "claim_ready": false,
      "evidence_basis": {
        "source_record": "G6 record_kind and record_id; no source payload read",
        "url": "G6 url.status and url.value",
        "license": "G6 license.status and license.label",
        "evidence_status": "G6 proof_state copied without promotion",
        "claim_ready": "not promoted; G6 has no explicit claim_ready=true evidence for this record"
      },
      "residual_codes": [
        "g6:external_url_availability_not_checked",
        "g6:independent_license_clearance_not_checked",
        "evidence_not_verified",
        "explicit_claim_ready_evidence_missing",
        "claim_not_ready"
      ]
    },
    {
      "record_key": "Fondamenti_Pack/PROVENANCE_MANIFEST_G2.json#G1-005",
      "manifest_path": "Fondamenti_Pack/PROVENANCE_MANIFEST_G2.json",
      "manifest_id": "G2-FONDAMENTI-PACK-G1-PROVENANCE",
      "record_id": "G1-005",
      "record_kind": "source",
      "title": "The Elements of Euclid",
      "local_path": "Fondamenti_Pack/raw/gutenberg/Euclid_Elements.txt",
      "source_record_present": true,
      "url_present": true,
      "license_present": true,
      "evidence_status": "observed_local",
      "claim_ready": false,
      "evidence_basis": {
        "source_record": "G6 record_kind and record_id; no source payload read",
        "url": "G6 url.status and url.value",
        "license": "G6 license.status and license.label",
        "evidence_status": "G6 proof_state copied without promotion",
        "claim_ready": "not promoted; G6 has no explicit claim_ready=true evidence for this record"
      },
      "residual_codes": [
        "g6:external_url_availability_not_checked",
        "g6:independent_license_clearance_not_checked",
        "evidence_not_verified",
        "explicit_claim_ready_evidence_missing",
        "claim_not_ready"
      ]
    },
    {
      "record_key": "Fondamenti_Pack/PROVENANCE_MANIFEST_G2.json#G1-006",
      "manifest_path": "Fondamenti_Pack/PROVENANCE_MANIFEST_G2.json",
      "manifest_id": "G2-FONDAMENTI-PACK-G1-PROVENANCE",
      "record_id": "G1-006",
      "record_kind": "source",
      "title": "Flatland: A Romance of Many Dimensions",
      "local_path": "Fondamenti_Pack/raw/gutenberg/Flatland_pg201.txt",
      "source_record_present": true,
      "url_present": true,
      "license_present": true,
      "evidence_status": "observed_local",
      "claim_ready": false,
      "evidence_basis": {
        "source_record": "G6 record_kind and record_id; no source payload read",
        "url": "G6 url.status and url.value",
        "license": "G6 license.status and license.label",
        "evidence_status": "G6 proof_state copied without promotion",
        "claim_ready": "not promoted; G6 has no explicit claim_ready=true evidence for this record"
      },
      "residual_codes": [
        "g6:external_url_availability_not_checked",
        "g6:independent_license_clearance_not_checked",
        "evidence_not_verified",
        "explicit_claim_ready_evidence_missing",
        "claim_not_ready"
      ]
    },
    {
      "record_key": "Fondamenti_Pack/PROVENANCE_MANIFEST_G2.json#G1-007",
      "manifest_path": "Fondamenti_Pack/PROVENANCE_MANIFEST_G2.json",
      "manifest_id": "G2-FONDAMENTI-PACK-G1-PROVENANCE",
      "record_id": "G1-007",
      "record_kind": "source",
      "title": "The Critique of Pure Reason",
      "local_path": "Fondamenti_Pack/raw/gutenberg/Kant_Critique_pg4280.txt",
      "source_record_present": true,
      "url_present": true,
      "license_present": true,
      "evidence_status": "observed_local",
      "claim_ready": false,
      "evidence_basis": {
        "source_record": "G6 record_kind and record_id; no source payload read",
        "url": "G6 url.status and url.value",
        "license": "G6 license.status and license.label",
        "evidence_status": "G6 proof_state copied without promotion",
        "claim_ready": "not promoted; G6 has no explicit claim_ready=true evidence for this record"
      },
      "residual_codes": [
        "g6:external_url_availability_not_checked",
        "g6:independent_license_clearance_not_checked",
        "evidence_not_verified",
        "explicit_claim_ready_evidence_missing",
        "claim_not_ready"
      ]
    },
    {
      "record_key": "Fondamenti_Pack/PROVENANCE_MANIFEST_G2.json#G1-008",
      "manifest_path": "Fondamenti_Pack/PROVENANCE_MANIFEST_G2.json",
      "manifest_id": "G2-FONDAMENTI-PACK-G1-PROVENANCE",
      "record_id": "G1-008",